{
  "analysis": {
    "critical_dependencies": [
      "fixture-only"
    ],
    "material_conclusion": "Schlussfolgerung B-A2-de. Geltungsbereich: fiktiver Fall A2, Sprache de.",
    "reversal_conditions": [
      "Umkehrbedingung B-A2-de."
    ],
    "routes": [
      "pre_registered_reference"
    ],
    "useful_uncertainties": [
      "Nützliche Unsicherheit B-A2-de."
    ]
  },
  "packet_sha256": "2ad11829da426cde863cab440a7c2417737c049ffe18faf9719cd17f3ae21dc5",
  "raw_prompt": "Référence de paquet B / A2 / de",
  "schema": "corpus-analytic-packet/v1"
}
